Router Solicitation from 00:00:00:00:00:01
Router Solicitation from 00:00:00:00:00:02
Router Solicitation from 00:00:00:00:00:01
Router Solicitation from 00:00:00:00:00:02
5001 → 5001 [SYN] Seq=0 Win=29200 Len=0 MSS=1460 SACK_PERM=1 TSval=1250 TSecr=0 WS=4
5001 → 5001 [SYN, ACK] Seq=0 Ack=1 Win=28560 Len=0 MSS=1460 SACK_PERM=1 TSval=1257 TSecr=1250 WS=4
5001 → 5001 [ACK] Seq=1 Ack=1 Win=29200 Len=0 TSval=1265 TSecr=1257
[TCP Dup ACK 7#1] 5001 → 5001 [ACK] Seq=1 Ack=1 Win=29200 Len=0 TSval=1265 TSecr=1257
5001 → 5001 [PSH, ACK] Seq=1 Ack=1 Win=29200 Len=24 TSval=1265 TSecr=1257
5001 → 5001 [PSH, ACK] Seq=25 Ack=1 Win=29200 Len=1428 TSval=1265 TSecr=1257
5001 → 5001 [PSH, ACK] Seq=1453 Ack=1 Win=29200 Len=1428 TSval=1265 TSecr=1257
5001 → 5001 [PSH, ACK] Seq=2881 Ack=1 Win=29200 Len=1428 TSval=1265 TSecr=1257
5001 → 5001 [PSH, ACK] Seq=4309 Ack=1 Win=29200 Len=1428 TSval=1265 TSecr=1257
5001 → 5001 [PSH, ACK] Seq=5737 Ack=1 Win=29200 Len=1428 TSval=1265 TSecr=1257
5001 → 5001 [PSH, ACK] Seq=7165 Ack=1 Win=29200 Len=1428 TSval=1265 TSecr=1257
5001 → 5001 [PSH, ACK] Seq=8593 Ack=1 Win=29200 Len=1428 TSval=1265 TSecr=1257
5001 → 5001 [PSH, ACK] Seq=10021 Ack=1 Win=29200 Len=1428 TSval=1265 TSecr=1257
5001 → 5001 [PSH, ACK] Seq=11449 Ack=1 Win=29200 Len=1428 TSval=1265 TSecr=1257
[TCP Window Update] 5001 → 5001 [ACK] Seq=1 Ack=1 Win=28560 Len=0 TSval=1272 TSecr=1265
5001 → 5001 [ACK] Seq=1 Ack=25 Win=28560 Len=0 TSval=1272 TSecr=1265
5001 → 5001 [PSH, ACK] Seq=12877 Ack=1 Win=29200 Len=1428 TSval=1280 TSecr=1272
5001 → 5001 [PSH, ACK] Seq=14305 Ack=1 Win=29200 Len=1428 TSval=1280 TSecr=1272
5001 → 5001 [ACK] Seq=1 Ack=1453 Win=31480 Len=0 TSval=1273 TSecr=1265
43376 → 5001 [SYN] Seq=0 Win=29200 Len=0 MSS=1460 SACK_PERM=1 TSval=1280 TSecr=0 WS=4
5001 → 5001 [ACK] Seq=1 Ack=2881 Win=34400 Len=0 TSval=1273 TSecr=1265
49078 → 5001 [SYN] Seq=0 Win=29200 Len=0 MSS=1460 SACK_PERM=1 TSval=1280 TSecr=0 WS=4
57841 → 5001 [SYN] Seq=0 Win=29200 Len=0 MSS=1460 SACK_PERM=1 TSval=1280 TSecr=0 WS=4
5001 → 5001 [PSH, ACK] Seq=15733 Ack=1 Win=29200 Len=1428 TSval=1280 TSecr=1273
5001 → 5001 [ACK] Seq=1 Ack=4309 Win=37320 Len=0 TSval=1274 TSecr=1265
5001 → 5001 [PSH, ACK] Seq=17161 Ack=1 Win=29200 Len=1428 TSval=1280 TSecr=1273
5001 → 5001 [ACK] Seq=1 Ack=5737 Win=40240 Len=0 TSval=1275 TSecr=1265
5001 → 5001 [PSH, ACK] Seq=18589 Ack=1 Win=29200 Len=1428 TSval=1281 TSecr=1273
5001 → 5001 [ACK] Seq=1 Ack=7165 Win=42232 Len=0 TSval=1275 TSecr=1265
5001 → 5001 [PSH, ACK] Seq=20017 Ack=1 Win=29200 Len=1428 TSval=1281 TSecr=1273
5001 → 5001 [ACK] Seq=1 Ack=8593 Win=42232 Len=0 TSval=1276 TSecr=1265
5001 → 5001 [PSH, ACK] Seq=21445 Ack=1 Win=29200 Len=1428 TSval=1282 TSecr=1274
5001 → 5001 [ACK] Seq=1 Ack=10021 Win=42232 Len=0 TSval=1276 TSecr=1265
5001 → 5001 [PSH, ACK] Seq=22873 Ack=1 Win=29200 Len=1428 TSval=1282 TSecr=1274
5001 → 5001 [ACK] Seq=1 Ack=11449 Win=42232 Len=0 TSval=1277 TSecr=1265
5001 → 5001 [PSH, ACK] Seq=24301 Ack=1 Win=29200 Len=1428 TSval=1282 TSecr=1275
5001 → 5001 [ACK] Seq=1 Ack=12877 Win=42232 Len=0 TSval=1278 TSecr=1265
5001 → 5001 [PSH, ACK] Seq=25729 Ack=1 Win=29200 Len=1428 TSval=1282 TSecr=1275
5001 → 5001 [PSH, ACK] Seq=27157 Ack=1 Win=29200 Len=1428 TSval=1283 TSecr=1275
5001 → 5001 [ACK] Seq=28585 Ack=1 Win=29200 Len=1428 TSval=1283 TSecr=1275
5001 → 5001 [ACK] Seq=30013 Ack=1 Win=29200 Len=1428 TSval=1283 TSecr=1276
5001 → 5001 [ACK] Seq=31441 Ack=1 Win=29200 Len=1428 TSval=1283 TSecr=1276
5001 → 5001 [ACK] Seq=32869 Ack=1 Win=29200 Len=1428 TSval=1284 TSecr=1276
5001 → 5001 [ACK] Seq=34297 Ack=1 Win=29200 Len=1428 TSval=1284 TSecr=1276
5001 → 5001 [ACK] Seq=35725 Ack=1 Win=29200 Len=1428 TSval=1285 TSecr=1277
5001 → 5001 [ACK] Seq=37153 Ack=1 Win=29200 Len=1428 TSval=1285 TSecr=1277
5001 → 5001 [ACK] Seq=38581 Ack=1 Win=29200 Len=1428 TSval=1285 TSecr=1278
5001 → 5001 [ACK] Seq=40009 Ack=1 Win=29200 Len=1428 TSval=1285 TSecr=1278
5001 → 5001 [ACK] Seq=1 Ack=14305 Win=42232 Len=0 TSval=1288 TSecr=1280
5001 → 5001 [PSH, ACK] Seq=41437 Ack=1 Win=29200 Len=1428 TSval=1295 TSecr=1288
5001 → 5001 [ACK] Seq=1 Ack=15733 Win=42232 Len=0 TSval=1288 TSecr=1280
5001 → 5001 [ACK] Seq=42865 Ack=1 Win=29200 Len=1428 TSval=1296 TSecr=1288
5001 → 49078 [SYN, ACK] Seq=0 Ack=1 Win=28560 Len=0 MSS=1460 SACK_PERM=1 TSval=1288 TSecr=1280 WS=4
5001 → 5001 [ACK] Seq=44293 Ack=1 Win=29200 Len=1428 TSval=1296 TSecr=1288
5001 → 5001 [ACK] Seq=1 Ack=17161 Win=42232 Len=0 TSval=1289 TSecr=1280
5001 → 5001 [ACK] Seq=45721 Ack=1 Win=29200 Len=1428 TSval=1296 TSecr=1288
5001 → 5001 [ACK] Seq=1 Ack=18589 Win=42232 Len=0 TSval=1290 TSecr=1280
49078 → 5001 [ACK] Seq=1 Ack=1 Win=29200 Len=0 TSval=1296 TSecr=1288
5001 → 5001 [ACK] Seq=47149 Ack=1 Win=29200 Len=1428 TSval=1297 TSecr=1289
5001 → 5001 [ACK] Seq=1 Ack=20017 Win=42232 Len=0 TSval=1290 TSecr=1281
5001 → 5001 [ACK] Seq=48577 Ack=1 Win=29200 Len=1428 TSval=1297 TSecr=1289
5001 → 5001 [ACK] Seq=1 Ack=21445 Win=42232 Len=0 TSval=1291 TSecr=1281
5001 → 5001 [ACK] Seq=50005 Ack=1 Win=29200 Len=1428 TSval=1297 TSecr=1290
5001 → 5001 [ACK] Seq=1 Ack=22873 Win=42232 Len=0 TSval=1292 TSecr=1282
5001 → 5001 [ACK] Seq=51433 Ack=1 Win=29200 Len=1428 TSval=1297 TSecr=1290
5001 → 5001 [ACK] Seq=1 Ack=24301 Win=42232 Len=0 TSval=1292 TSecr=1282
5001 → 5001 [ACK] Seq=52861 Ack=1 Win=29200 Len=1428 TSval=1298 TSecr=1290
5001 → 5001 [ACK] Seq=1 Ack=25729 Win=42232 Len=0 TSval=1293 TSecr=1282
5001 → 5001 [ACK] Seq=54289 Ack=1 Win=29200 Len=1428 TSval=1298 TSecr=1290
5001 → 5001 [ACK] Seq=1 Ack=27157 Win=42232 Len=0 TSval=1293 TSecr=1282
5001 → 5001 [ACK] Seq=55717 Ack=1 Win=29200 Len=1428 TSval=1298 TSecr=1291
5001 → 5001 [PSH, ACK] Seq=57145 Ack=1 Win=29200 Len=1428 TSval=1298 TSecr=1291
5001 → 5001 [ACK] Seq=1 Ack=30013 Win=42232 Len=0 TSval=1295 TSecr=1283
5001 → 5001 [ACK] Seq=1 Ack=32869 Win=42232 Len=0 TSval=1296 TSecr=1283
5001 → 5001 [ACK] Seq=58573 Ack=1 Win=29200 Len=1428 TSval=1303 TSecr=1296
5001 → 5001 [ACK] Seq=60001 Ack=1 Win=29200 Len=1428 TSval=1303 TSecr=1296
5001 → 5001 [ACK] Seq=1 Ack=35725 Win=42232 Len=0 TSval=1297 TSecr=1284
5001 → 5001 [ACK] Seq=61429 Ack=1 Win=29200 Len=1428 TSval=1303 TSecr=1296
5001 → 5001 [ACK] Seq=62857 Ack=1 Win=29200 Len=1428 TSval=1303 TSecr=1296
5001 → 5001 [ACK] Seq=1 Ack=38581 Win=42232 Len=0 TSval=1298 TSecr=1285
5001 → 5001 [ACK] Seq=64285 Ack=1 Win=29200 Len=1428 TSval=1303 TSecr=1296
5001 → 5001 [ACK] Seq=65713 Ack=1 Win=29200 Len=1428 TSval=1303 TSecr=1296
5001 → 5001 [ACK] Seq=1 Ack=41437 Win=42232 Len=0 TSval=1299 TSecr=1285
5001 → 5001 [ACK] Seq=67141 Ack=1 Win=29200 Len=1428 TSval=1303 TSecr=1296
5001 → 5001 [ACK] Seq=68569 Ack=1 Win=29200 Len=1428 TSval=1303 TSecr=1296
5001 → 5001 [ACK] Seq=69997 Ack=1 Win=29200 Len=1428 TSval=1303 TSecr=1296
5001 → 5001 [ACK] Seq=71425 Ack=1 Win=29200 Len=1428 TSval=1303 TSecr=1296
5001 → 5001 [ACK] Seq=72853 Ack=1 Win=29200 Len=1428 TSval=1304 TSecr=1297
5001 → 5001 [PSH, ACK] Seq=74281 Ack=1 Win=29200 Len=1428 TSval=1304 TSecr=1297
5001 → 5001 [ACK] Seq=1 Ack=44293 Win=42232 Len=0 TSval=1304 TSecr=1295
5001 → 5001 [ACK] Seq=1 Ack=47149 Win=42232 Len=0 TSval=1305 TSecr=1296
[TCP Window Update] 5001 → 49078 [ACK] Seq=1 Ack=1 Win=42232 Len=0 TSval=1305 TSecr=1296
5001 → 5001 [ACK] Seq=1 Ack=50005 Win=42232 Len=0 TSval=1307 TSecr=1297
49078 → 5001 [ACK] Seq=1 Ack=1 Win=29200 Len=1428 TSval=1314 TSecr=1305
49078 → 5001 [ACK] Seq=1429 Ack=1 Win=29200 Len=1428 TSval=1314 TSecr=1305
5001 → 5001 [ACK] Seq=1 Ack=52861 Win=42232 Len=0 TSval=1308 TSecr=1297
49078 → 5001 [ACK] Seq=2857 Ack=1 Win=29200 Len=1428 TSval=1314 TSecr=1305
49078 → 5001 [ACK] Seq=4285 Ack=1 Win=29200 Len=1428 TSval=1314 TSecr=1305
5001 → 5001 [ACK] Seq=1 Ack=55717 Win=42232 Len=0 TSval=1309 TSecr=1298
49078 → 5001 [ACK] Seq=5713 Ack=1 Win=29200 Len=1428 TSval=1314 TSecr=1305
49078 → 5001 [ACK] Seq=7141 Ack=1 Win=29200 Len=1428 TSval=1314 TSecr=1305
5001 → 5001 [ACK] Seq=1 Ack=58573 Win=42232 Len=0 TSval=1310 TSecr=1298
49078 → 5001 [ACK] Seq=8569 Ack=1 Win=29200 Len=1428 TSval=1314 TSecr=1305
49078 → 5001 [ACK] Seq=9997 Ack=1 Win=29200 Len=1428 TSval=1314 TSecr=1305
49078 → 5001 [ACK] Seq=11425 Ack=1 Win=29200 Len=1428 TSval=1314 TSecr=1305
49078 → 5001 [ACK] Seq=12853 Ack=1 Win=29200 Len=1428 TSval=1314 TSecr=1305
5001 → 5001 [ACK] Seq=1 Ack=61429 Win=42232 Len=0 TSval=1312 TSecr=1303
5001 → 5001 [ACK] Seq=75709 Ack=1 Win=29200 Len=1428 TSval=1314 TSecr=1307
5001 → 5001 [PSH, ACK] Seq=77137 Ack=1 Win=29200 Len=1428 TSval=1315 TSecr=1307
5001 → 5001 [ACK] Seq=1 Ack=64285 Win=42232 Len=0 TSval=1313 TSecr=1303
5001 → 5001 [ACK] Seq=1 Ack=67141 Win=42232 Len=0 TSval=1314 TSecr=1303
5001 → 5001 [ACK] Seq=78565 Ack=1 Win=29200 Len=1428 TSval=1322 TSecr=1314
5001 → 5001 [ACK] Seq=79993 Ack=1 Win=29200 Len=1428 TSval=1322 TSecr=1314
5001 → 5001 [ACK] Seq=1 Ack=69997 Win=42232 Len=0 TSval=1316 TSecr=1303
5001 → 5001 [ACK] Seq=81421 Ack=1 Win=29200 Len=1428 TSval=1322 TSecr=1314
5001 → 5001 [ACK] Seq=82849 Ack=1 Win=29200 Len=1428 TSval=1322 TSecr=1314
5001 → 5001 [ACK] Seq=1 Ack=72853 Win=42232 Len=0 TSval=1317 TSecr=1303
5001 → 5001 [ACK] Seq=84277 Ack=1 Win=29200 Len=1428 TSval=1322 TSecr=1314
5001 → 5001 [ACK] Seq=85705 Ack=1 Win=29200 Len=1428 TSval=1322 TSecr=1314
5001 → 5001 [ACK] Seq=1 Ack=75709 Win=42232 Len=0 TSval=1318 TSecr=1304
5001 → 5001 [ACK] Seq=87133 Ack=1 Win=29200 Len=1428 TSval=1322 TSecr=1314
5001 → 5001 [ACK] Seq=88561 Ack=1 Win=29200 Len=1428 TSval=1322 TSecr=1314
5001 → 5001 [ACK] Seq=89989 Ack=1 Win=29200 Len=1428 TSval=1322 TSecr=1314
5001 → 5001 [ACK] Seq=91417 Ack=1 Win=29200 Len=1428 TSval=1322 TSecr=1314
5001 → 5001 [ACK] Seq=92845 Ack=1 Win=29200 Len=1428 TSval=1322 TSecr=1314
5001 → 5001 [PSH, ACK] Seq=94273 Ack=1 Win=29200 Len=1428 TSval=1323 TSecr=1314
5001 → 49078 [ACK] Seq=1 Ack=1429 Win=42232 Len=0 TSval=1322 TSecr=1314
5001 → 49078 [ACK] Seq=1 Ack=2857 Win=42232 Len=0 TSval=1323 TSecr=1314
5001 → 49078 [ACK] Seq=1 Ack=4285 Win=42232 Len=0 TSval=1323 TSecr=1314
5001 → 49078 [ACK] Seq=1 Ack=5713 Win=42232 Len=0 TSval=1324 TSecr=1314
5001 → 49078 [ACK] Seq=1 Ack=7141 Win=42232 Len=0 TSval=1325 TSecr=1314
49078 → 5001 [ACK] Seq=14281 Ack=1 Win=29200 Len=1428 TSval=1332 TSecr=1325
5001 → 49078 [ACK] Seq=1 Ack=8569 Win=42232 Len=0 TSval=1325 TSecr=1314
49078 → 5001 [ACK] Seq=15709 Ack=1 Win=29200 Len=1428 TSval=1332 TSecr=1325
5001 → 49078 [ACK] Seq=1 Ack=9997 Win=42232 Len=0 TSval=1326 TSecr=1314
49078 → 5001 [ACK] Seq=17137 Ack=1 Win=29200 Len=1428 TSval=1332 TSecr=1325
5001 → 49078 [ACK] Seq=1 Ack=11425 Win=42232 Len=0 TSval=1326 TSecr=1314
49078 → 5001 [ACK] Seq=18565 Ack=1 Win=29200 Len=1428 TSval=1332 TSecr=1325
5001 → 49078 [ACK] Seq=1 Ack=12853 Win=42232 Len=0 TSval=1327 TSecr=1314
49078 → 5001 [ACK] Seq=19993 Ack=1 Win=29200 Len=1428 TSval=1332 TSecr=1325
5001 → 49078 [ACK] Seq=1 Ack=14281 Win=42232 Len=0 TSval=1328 TSecr=1314
49078 → 5001 [ACK] Seq=21421 Ack=1 Win=29200 Len=1428 TSval=1332 TSecr=1325
49078 → 5001 [ACK] Seq=22849 Ack=1 Win=29200 Len=1428 TSval=1332 TSecr=1325
5001 → 5001 [ACK] Seq=1 Ack=78565 Win=42232 Len=0 TSval=1329 TSecr=1314
5001 → 5001 [ACK] Seq=95701 Ack=1 Win=29200 Len=1428 TSval=1332 TSecr=1318
5001 → 5001 [ACK] Seq=97129 Ack=1 Win=29200 Len=1428 TSval=1332 TSecr=1318
5001 → 5001 [ACK] Seq=98557 Ack=1 Win=29200 Len=1428 TSval=1332 TSecr=1318
5001 → 5001 [PSH, ACK] Seq=99985 Ack=1 Win=29200 Len=1428 TSval=1333 TSecr=1318
5001 → 5001 [ACK] Seq=1 Ack=81421 Win=42232 Len=0 TSval=1331 TSecr=1322
5001 → 5001 [ACK] Seq=1 Ack=84277 Win=42232 Len=0 TSval=1332 TSecr=1322
49078 → 5001 [ACK] Seq=24277 Ack=1 Win=29200 Len=1428 TSval=1339 TSecr=1328
49078 → 5001 [ACK] Seq=25705 Ack=1 Win=29200 Len=1428 TSval=1339 TSecr=1328
5001 → 5001 [ACK] Seq=1 Ack=87133 Win=42232 Len=0 TSval=1333 TSecr=1322
49078 → 5001 [ACK] Seq=27133 Ack=1 Win=29200 Len=1428 TSval=1339 TSecr=1328
49078 → 5001 [PSH, ACK] Seq=28561 Ack=1 Win=29200 Len=1124 TSval=1339 TSecr=1328
49078 → 5001 [ACK] Seq=29685 Ack=1 Win=29200 Len=1428 TSval=1339 TSecr=1328
5001 → 5001 [ACK] Seq=1 Ack=89989 Win=42232 Len=0 TSval=1334 TSecr=1322
49078 → 5001 [ACK] Seq=31113 Ack=1 Win=29200 Len=1428 TSval=1339 TSecr=1328
49078 → 5001 [ACK] Seq=32541 Ack=1 Win=29200 Len=1428 TSval=1339 TSecr=1328
5001 → 5001 [ACK] Seq=1 Ack=92845 Win=42232 Len=0 TSval=1335 TSecr=1322
5001 → 5001 [ACK] Seq=101413 Ack=1 Win=29200 Len=1428 TSval=1339 TSecr=1332
5001 → 5001 [ACK] Seq=102841 Ack=1 Win=29200 Len=1428 TSval=1339 TSecr=1332
5001 → 5001 [ACK] Seq=1 Ack=95701 Win=42232 Len=0 TSval=1337 TSecr=1322
5001 → 5001 [ACK] Seq=104269 Ack=1 Win=29200 Len=1428 TSval=1339 TSecr=1332
5001 → 5001 [PSH, ACK] Seq=105697 Ack=1 Win=29200 Len=1428 TSval=1341 TSecr=1332
5001 → 49078 [ACK] Seq=1 Ack=15709 Win=42232 Len=0 TSval=1340 TSecr=1332
5001 → 49078 [ACK] Seq=1 Ack=17137 Win=42232 Len=0 TSval=1341 TSecr=1332
5001 → 49078 [ACK] Seq=1 Ack=18565 Win=42232 Len=0 TSval=1341 TSecr=1332
49078 → 5001 [ACK] Seq=33969 Ack=1 Win=29200 Len=1428 TSval=1349 TSecr=1341
5001 → 49078 [ACK] Seq=1 Ack=19993 Win=42232 Len=0 TSval=1342 TSecr=1332
49078 → 5001 [ACK] Seq=35397 Ack=1 Win=29200 Len=1428 TSval=1349 TSecr=1341
49078 → 5001 [ACK] Seq=36825 Ack=1 Win=29200 Len=1428 TSval=1349 TSecr=1341
5001 → 49078 [ACK] Seq=1 Ack=22849 Win=42232 Len=0 TSval=1343 TSecr=1332
49078 → 5001 [ACK] Seq=38253 Ack=1 Win=29200 Len=1428 TSval=1349 TSecr=1341
49078 → 5001 [ACK] Seq=39681 Ack=1 Win=29200 Len=1428 TSval=1349 TSecr=1341
5001 → 5001 [ACK] Seq=107125 Ack=1 Win=29200 Len=1428 TSval=1349 TSecr=1337
5001 → 5001 [ACK] Seq=1 Ack=98557 Win=42232 Len=0 TSval=1345 TSecr=1332
5001 → 5001 [ACK] Seq=108553 Ack=1 Win=29200 Len=1428 TSval=1349 TSecr=1337
5001 → 5001 [ACK] Seq=109981 Ack=1 Win=29200 Len=1428 TSval=1349 TSecr=1337
5001 → 5001 [ACK] Seq=1 Ack=101413 Win=42232 Len=0 TSval=1346 TSecr=1332
5001 → 5001 [ACK] Seq=111409 Ack=1 Win=29200 Len=1428 TSval=1349 TSecr=1337
5001 → 5001 [ACK] Seq=112837 Ack=1 Win=29200 Len=1428 TSval=1349 TSecr=1337
5001 → 5001 [PSH, ACK] Seq=114265 Ack=1 Win=29200 Len=1428 TSval=1350 TSecr=1337
5001 → 49078 [ACK] Seq=1 Ack=25705 Win=42232 Len=0 TSval=1347 TSecr=1332
5001 → 49078 [ACK] Seq=1 Ack=28561 Win=42232 Len=0 TSval=1349 TSecr=1339
49078 → 5001 [ACK] Seq=41109 Ack=1 Win=29200 Len=1428 TSval=1356 TSecr=1349
5001 → 49078 [ACK] Seq=1 Ack=29685 Win=42232 Len=0 TSval=1349 TSecr=1339
49078 → 5001 [ACK] Seq=42537 Ack=1 Win=29200 Len=1428 TSval=1356 TSecr=1349
49078 → 5001 [ACK] Seq=43965 Ack=1 Win=29200 Len=1428 TSval=1356 TSecr=1349
5001 → 49078 [ACK] Seq=1 Ack=32541 Win=42232 Len=0 TSval=1350 TSecr=1339
49078 → 5001 [ACK] Seq=45393 Ack=1 Win=29200 Len=1428 TSval=1356 TSecr=1349
49078 → 5001 [ACK] Seq=46821 Ack=1 Win=29200 Len=1428 TSval=1356 TSecr=1349
49078 → 5001 [ACK] Seq=48249 Ack=1 Win=29200 Len=1428 TSval=1356 TSecr=1349
5001 → 5001 [ACK] Seq=1 Ack=104269 Win=42232 Len=0 TSval=1352 TSecr=1339
49078 → 5001 [ACK] Seq=49677 Ack=1 Win=29200 Len=1428 TSval=1356 TSecr=1349
49078 → 5001 [ACK] Seq=51105 Ack=1 Win=29200 Len=1428 TSval=1356 TSecr=1349
5001 → 5001 [ACK] Seq=1 Ack=107125 Win=42232 Len=0 TSval=1353 TSecr=1339
49078 → 5001 [ACK] Seq=52533 Ack=1 Win=29200 Len=1428 TSval=1356 TSecr=1349
49078 → 5001 [ACK] Seq=53961 Ack=1 Win=29200 Len=1428 TSval=1356 TSecr=1349
5001 → 5001 [PSH, ACK] Seq=115693 Ack=1 Win=29200 Len=1428 TSval=1357 TSecr=1346
5001 → 49078 [ACK] Seq=1 Ack=35397 Win=42232 Len=0 TSval=1357 TSecr=1339
5001 → 49078 [ACK] Seq=1 Ack=38253 Win=42232 Len=0 TSval=1358 TSecr=1349
49078 → 5001 [ACK] Seq=55389 Ack=1 Win=29200 Len=1428 TSval=1366 TSecr=1358
49078 → 5001 [ACK] Seq=56817 Ack=1 Win=29200 Len=1428 TSval=1366 TSecr=1358
5001 → 49078 [ACK] Seq=1 Ack=41109 Win=42232 Len=0 TSval=1359 TSecr=1349
49078 → 5001 [ACK] Seq=58245 Ack=1 Win=29200 Len=1428 TSval=1366 TSecr=1358
49078 → 5001 [ACK] Seq=59673 Ack=1 Win=29200 Len=1428 TSval=1366 TSecr=1358
5001 → 5001 [ACK] Seq=1 Ack=109981 Win=42232 Len=0 TSval=1361 TSecr=1349
49078 → 5001 [ACK] Seq=61101 Ack=1 Win=29200 Len=1428 TSval=1366 TSecr=1358
49078 → 5001 [ACK] Seq=62529 Ack=1 Win=29200 Len=1428 TSval=1366 TSecr=1358
5001 → 5001 [ACK] Seq=1 Ack=112837 Win=42232 Len=0 TSval=1362 TSecr=1349
49078 → 5001 [ACK] Seq=63957 Ack=1 Win=29200 Len=1428 TSval=1366 TSecr=1358
49078 → 5001 [ACK] Seq=65385 Ack=1 Win=29200 Len=1428 TSval=1366 TSecr=1358
5001 → 5001 [ACK] Seq=1 Ack=115693 Win=42232 Len=0 TSval=1363 TSecr=1349
49078 → 5001 [ACK] Seq=66813 Ack=1 Win=29200 Len=1428 TSval=1366 TSecr=1358
49078 → 5001 [ACK] Seq=68241 Ack=1 Win=29200 Len=1428 TSval=1366 TSecr=1358
5001 → 5001 [PSH, ACK] Seq=117121 Ack=1 Win=29200 Len=1428 TSval=1367 TSecr=1353
5001 → 49078 [ACK] Seq=1 Ack=43965 Win=42232 Len=0 TSval=1365 TSecr=1356
5001 → 49078 [ACK] Seq=1 Ack=46821 Win=42232 Len=0 TSval=1366 TSecr=1356
49078 → 5001 [ACK] Seq=69669 Ack=1 Win=29200 Len=1428 TSval=1374 TSecr=1366
49078 → 5001 [ACK] Seq=71097 Ack=1 Win=29200 Len=1428 TSval=1374 TSecr=1366
5001 → 49078 [ACK] Seq=1 Ack=49677 Win=42232 Len=0 TSval=1367 TSecr=1356
49078 → 5001 [ACK] Seq=72525 Ack=1 Win=29200 Len=1428 TSval=1374 TSecr=1366
49078 → 5001 [ACK] Seq=73953 Ack=1 Win=29200 Len=1428 TSval=1374 TSecr=1366
5001 → 49078 [ACK] Seq=1 Ack=52533 Win=42232 Len=0 TSval=1369 TSecr=1356
49078 → 5001 [ACK] Seq=75381 Ack=1 Win=29200 Len=1428 TSval=1374 TSecr=1366
49078 → 5001 [ACK] Seq=76809 Ack=1 Win=29200 Len=1428 TSval=1374 TSecr=1366
5001 → 49078 [ACK] Seq=1 Ack=55389 Win=42232 Len=0 TSval=1370 TSecr=1356
49078 → 5001 [ACK] Seq=78237 Ack=1 Win=29200 Len=1428 TSval=1374 TSecr=1366
49078 → 5001 [ACK] Seq=79665 Ack=1 Win=29200 Len=1428 TSval=1374 TSecr=1366
5001 → 5001 [ACK] Seq=118549 Ack=1 Win=29200 Len=1428 TSval=1374 TSecr=1363
5001 → 5001 [ACK] Seq=119977 Ack=1 Win=29200 Len=1428 TSval=1374 TSecr=1363
5001 → 5001 [ACK] Seq=121405 Ack=1 Win=29200 Len=1428 TSval=1374 TSecr=1363
5001 → 5001 [PSH, ACK] Seq=122833 Ack=1 Win=29200 Len=1428 TSval=1375 TSecr=1363
5001 → 49078 [ACK] Seq=1 Ack=58245 Win=42232 Len=0 TSval=1375 TSecr=1366
5001 → 49078 [ACK] Seq=1 Ack=61101 Win=42232 Len=0 TSval=1376 TSecr=1366
49078 → 5001 [ACK] Seq=81093 Ack=1 Win=29200 Len=1428 TSval=1383 TSecr=1376
49078 → 5001 [ACK] Seq=82521 Ack=1 Win=29200 Len=1428 TSval=1383 TSecr=1376
5001 → 49078 [ACK] Seq=1 Ack=63957 Win=42232 Len=0 TSval=1377 TSecr=1366
49078 → 5001 [ACK] Seq=83949 Ack=1 Win=29200 Len=1428 TSval=1383 TSecr=1376
49078 → 5001 [ACK] Seq=85377 Ack=1 Win=29200 Len=1428 TSval=1383 TSecr=1376
5001 → 49078 [ACK] Seq=1 Ack=66813 Win=42232 Len=0 TSval=1378 TSecr=1366
49078 → 5001 [ACK] Seq=86805 Ack=1 Win=29200 Len=1428 TSval=1383 TSecr=1376
49078 → 5001 [ACK] Seq=88233 Ack=1 Win=29200 Len=1428 TSval=1383 TSecr=1376
5001 → 49078 [ACK] Seq=1 Ack=69669 Win=42232 Len=0 TSval=1379 TSecr=1366
49078 → 5001 [ACK] Seq=89661 Ack=1 Win=29200 Len=1428 TSval=1383 TSecr=1376
5001 → 5001 [ACK] Seq=1 Ack=118549 Win=42232 Len=0 TSval=1380 TSecr=1357
49078 → 5001 [ACK] Seq=91089 Ack=1 Win=29200 Len=1428 TSval=1383 TSecr=1376
49078 → 5001 [ACK] Seq=92517 Ack=1 Win=29200 Len=1428 TSval=1383 TSecr=1376
49078 → 5001 [ACK] Seq=93945 Ack=1 Win=29200 Len=1428 TSval=1383 TSecr=1376
49078 → 5001 [PSH, ACK] Seq=95373 Ack=1 Win=29200 Len=1428 TSval=1384 TSecr=1376
5001 → 49078 [ACK] Seq=1 Ack=72525 Win=42232 Len=0 TSval=1382 TSecr=1374
5001 → 49078 [ACK] Seq=1 Ack=75381 Win=42232 Len=0 TSval=1384 TSecr=1374
49078 → 5001 [ACK] Seq=96801 Ack=1 Win=29200 Len=1428 TSval=1391 TSecr=1384
49078 → 5001 [ACK] Seq=98229 Ack=1 Win=29200 Len=1428 TSval=1391 TSecr=1384
5001 → 49078 [ACK] Seq=1 Ack=78237 Win=42232 Len=0 TSval=1385 TSecr=1374
49078 → 5001 [ACK] Seq=99657 Ack=1 Win=29200 Len=1428 TSval=1391 TSecr=1384
49078 → 5001 [ACK] Seq=101085 Ack=1 Win=29200 Len=1428 TSval=1391 TSecr=1384
5001 → 49078 [ACK] Seq=1 Ack=81093 Win=42232 Len=0 TSval=1386 TSecr=1374
49078 → 5001 [ACK] Seq=102513 Ack=1 Win=29200 Len=1428 TSval=1391 TSecr=1384
49078 → 5001 [ACK] Seq=103941 Ack=1 Win=29200 Len=1428 TSval=1391 TSecr=1384
5001 → 5001 [ACK] Seq=1 Ack=121405 Win=42232 Len=0 TSval=1387 TSecr=1374
49078 → 5001 [ACK] Seq=105369 Ack=1 Win=29200 Len=1428 TSval=1391 TSecr=1384
49078 → 5001 [ACK] Seq=106797 Ack=1 Win=29200 Len=1428 TSval=1391 TSecr=1384
5001 → 5001 [ACK] Seq=1 Ack=124261 Win=42232 Len=0 TSval=1388 TSecr=1374
49078 → 5001 [ACK] Seq=108225 Ack=1 Win=29200 Len=1428 TSval=1391 TSecr=1384
49078 → 5001 [ACK] Seq=109653 Ack=1 Win=29200 Len=1428 TSval=1391 TSecr=1384
49078 → 5001 [PSH, ACK] Seq=111081 Ack=1 Win=29200 Len=1428 TSval=1392 TSecr=1384
5001 → 49078 [ACK] Seq=1 Ack=83949 Win=42232 Len=0 TSval=1392 TSecr=1383
5001 → 49078 [ACK] Seq=1 Ack=86805 Win=42232 Len=0 TSval=1393 TSecr=1383
49078 → 5001 [ACK] Seq=112509 Ack=1 Win=29200 Len=1428 TSval=1401 TSecr=1393
49078 → 5001 [ACK] Seq=113937 Ack=1 Win=29200 Len=1428 TSval=1401 TSecr=1393
5001 → 49078 [ACK] Seq=1 Ack=89661 Win=42232 Len=0 TSval=1394 TSecr=1383
49078 → 5001 [ACK] Seq=115365 Ack=1 Win=29200 Len=1428 TSval=1401 TSecr=1393
49078 → 5001 [ACK] Seq=116793 Ack=1 Win=29200 Len=1428 TSval=1401 TSecr=1393
5001 → 49078 [ACK] Seq=1 Ack=92517 Win=42232 Len=0 TSval=1396 TSecr=1383
49078 → 5001 [ACK] Seq=118221 Ack=1 Win=29200 Len=1428 TSval=1401 TSecr=1393
49078 → 5001 [ACK] Seq=119649 Ack=1 Win=29200 Len=1428 TSval=1401 TSecr=1393
5001 → 49078 [ACK] Seq=1 Ack=95373 Win=42232 Len=0 TSval=1397 TSecr=1383
49078 → 5001 [ACK] Seq=121077 Ack=1 Win=29200 Len=1428 TSval=1401 TSecr=1393
49078 → 5001 [ACK] Seq=122505 Ack=1 Win=29200 Len=1428 TSval=1401 TSecr=1393
49078 → 5001 [ACK] Seq=123933 Ack=1 Win=29200 Len=1428 TSval=1401 TSecr=1393
49078 → 5001 [ACK] Seq=125361 Ack=1 Win=29200 Len=1428 TSval=1401 TSecr=1393
49078 → 5001 [ACK] Seq=126789 Ack=1 Win=29200 Len=1428 TSval=1401 TSecr=1393
5001 → 49078 [ACK] Seq=1 Ack=98229 Win=42232 Len=0 TSval=1399 TSecr=1384
5001 → 5001 [PSH, ACK] Seq=124261 Ack=1 Win=29200 Len=1428 TSval=1402 TSecr=1388
5001 → 49078 [ACK] Seq=1 Ack=101085 Win=42232 Len=0 TSval=1400 TSecr=1391
5001 → 49078 [ACK] Seq=1 Ack=103941 Win=42232 Len=0 TSval=1402 TSecr=1391
49078 → 5001 [ACK] Seq=128217 Ack=1 Win=29200 Len=1428 TSval=1409 TSecr=1402
49078 → 5001 [ACK] Seq=129645 Ack=1 Win=29200 Len=1428 TSval=1409 TSecr=1402
5001 → 49078 [ACK] Seq=1 Ack=106797 Win=42232 Len=0 TSval=1403 TSecr=1391
49078 → 5001 [ACK] Seq=131073 Ack=1 Win=29200 Len=1428 TSval=1409 TSecr=1402
49078 → 5001 [ACK] Seq=132501 Ack=1 Win=29200 Len=1428 TSval=1409 TSecr=1402
5001 → 49078 [ACK] Seq=1 Ack=109653 Win=42232 Len=0 TSval=1404 TSecr=1391
49078 → 5001 [ACK] Seq=133929 Ack=1 Win=29200 Len=1428 TSval=1409 TSecr=1402
49078 → 5001 [PSH, ACK] Seq=135357 Ack=1 Win=29200 Len=1124 TSval=1409 TSecr=1402
49078 → 5001 [ACK] Seq=136481 Ack=1 Win=29200 Len=1428 TSval=1409 TSecr=1402
5001 → 49078 [ACK] Seq=1 Ack=112509 Win=42232 Len=0 TSval=1405 TSecr=1391
49078 → 5001 [ACK] Seq=137909 Ack=1 Win=29200 Len=1428 TSval=1409 TSecr=1402
49078 → 5001 [ACK] Seq=139337 Ack=1 Win=29200 Len=1428 TSval=1409 TSecr=1402
49078 → 5001 [ACK] Seq=140765 Ack=1 Win=29200 Len=1428 TSval=1409 TSecr=1402
49078 → 5001 [ACK] Seq=142193 Ack=1 Win=29200 Len=1428 TSval=1409 TSecr=1402
49078 → 5001 [PSH, ACK] Seq=143621 Ack=1 Win=29200 Len=1428 TSval=1410 TSecr=1402
5001 → 49078 [ACK] Seq=1 Ack=115365 Win=42232 Len=0 TSval=1409 TSecr=1401
5001 → 49078 [ACK] Seq=1 Ack=118221 Win=42232 Len=0 TSval=1411 TSecr=1401
5001 → 49078 [ACK] Seq=1 Ack=121077 Win=42232 Len=0 TSval=1412 TSecr=1401
49078 → 5001 [ACK] Seq=145049 Ack=1 Win=29200 Len=1428 TSval=1419 TSecr=1412
49078 → 5001 [ACK] Seq=146477 Ack=1 Win=29200 Len=1428 TSval=1419 TSecr=1412
5001 → 49078 [ACK] Seq=1 Ack=123933 Win=42232 Len=0 TSval=1413 TSecr=1401
49078 → 5001 [ACK] Seq=147905 Ack=1 Win=29200 Len=1428 TSval=1419 TSecr=1412
49078 → 5001 [ACK] Seq=149333 Ack=1 Win=29200 Len=1428 TSval=1419 TSecr=1412
5001 → 49078 [ACK] Seq=1 Ack=126789 Win=42232 Len=0 TSval=1414 TSecr=1401
49078 → 5001 [ACK] Seq=150761 Ack=1 Win=29200 Len=1428 TSval=1419 TSecr=1412
49078 → 5001 [ACK] Seq=152189 Ack=1 Win=29200 Len=1428 TSval=1419 TSecr=1412
49078 → 5001 [ACK] Seq=153617 Ack=1 Win=29200 Len=1428 TSval=1419 TSecr=1412
49078 → 5001 [ACK] Seq=155045 Ack=1 Win=29200 Len=1428 TSval=1419 TSecr=1412
49078 → 5001 [ACK] Seq=156473 Ack=1 Win=29200 Len=1428 TSval=1419 TSecr=1412
49078 → 5001 [ACK] Seq=157901 Ack=1 Win=29200 Len=1428 TSval=1419 TSecr=1412
5001 → 49078 [ACK] Seq=1 Ack=129645 Win=42232 Len=0 TSval=1417 TSecr=1401
49078 → 5001 [ACK] Seq=159329 Ack=1 Win=29200 Len=1428 TSval=1419 TSecr=1412
49078 → 5001 [PSH, ACK] Seq=160757 Ack=1 Win=29200 Len=1428 TSval=1421 TSecr=1412
5001 → 49078 [ACK] Seq=1 Ack=132501 Win=42232 Len=0 TSval=1419 TSecr=1409
5001 → 49078 [ACK] Seq=1 Ack=135357 Win=42232 Len=0 TSval=1420 TSecr=1409
49078 → 5001 [ACK] Seq=162185 Ack=1 Win=29200 Len=1428 TSval=1427 TSecr=1420
5001 → 49078 [ACK] Seq=1 Ack=136481 Win=42232 Len=0 TSval=1420 TSecr=1409
49078 → 5001 [ACK] Seq=163613 Ack=1 Win=29200 Len=1428 TSval=1427 TSecr=1420
49078 → 5001 [ACK] Seq=165041 Ack=1 Win=29200 Len=1428 TSval=1427 TSecr=1420
5001 → 49078 [ACK] Seq=1 Ack=139337 Win=42232 Len=0 TSval=1421 TSecr=1409
49078 → 5001 [ACK] Seq=166469 Ack=1 Win=29200 Len=1428 TSval=1427 TSecr=1420
49078 → 5001 [ACK] Seq=167897 Ack=1 Win=29200 Len=1428 TSval=1427 TSecr=1420
5001 → 49078 [ACK] Seq=1 Ack=142193 Win=42232 Len=0 TSval=1423 TSecr=1409
49078 → 5001 [ACK] Seq=169325 Ack=1 Win=29200 Len=1428 TSval=1427 TSecr=1420
49078 → 5001 [ACK] Seq=170753 Ack=1 Win=29200 Len=1428 TSval=1427 TSecr=1420
5001 → 49078 [ACK] Seq=1 Ack=145049 Win=42232 Len=0 TSval=1424 TSecr=1409
49078 → 5001 [ACK] Seq=172181 Ack=1 Win=29200 Len=1428 TSval=1427 TSecr=1420
5001 → 5001 [ACK] Seq=1 Ack=125689 Win=42232 Len=0 TSval=1425 TSecr=1402
49078 → 5001 [ACK] Seq=173609 Ack=1 Win=29200 Len=1428 TSval=1427 TSecr=1420
49078 → 5001 [ACK] Seq=175037 Ack=1 Win=29200 Len=1428 TSval=1427 TSecr=1420
5001 → 5001 [PSH, ACK] Seq=125689 Ack=1 Win=29200 Len=1428 TSval=1428 TSecr=1388
5001 → 49078 [ACK] Seq=1 Ack=147905 Win=42232 Len=0 TSval=1428 TSecr=1419
5001 → 49078 [ACK] Seq=1 Ack=150761 Win=42232 Len=0 TSval=1429 TSecr=1419
49078 → 5001 [ACK] Seq=176465 Ack=1 Win=29200 Len=1428 TSval=1437 TSecr=1429
49078 → 5001 [ACK] Seq=177893 Ack=1 Win=29200 Len=1428 TSval=1437 TSecr=1429
5001 → 49078 [ACK] Seq=1 Ack=153617 Win=42232 Len=0 TSval=1431 TSecr=1419
49078 → 5001 [ACK] Seq=179321 Ack=1 Win=29200 Len=1428 TSval=1437 TSecr=1429
49078 → 5001 [ACK] Seq=180749 Ack=1 Win=29200 Len=1428 TSval=1437 TSecr=1429
5001 → 49078 [ACK] Seq=1 Ack=156473 Win=42232 Len=0 TSval=1432 TSecr=1419
49078 → 5001 [ACK] Seq=182177 Ack=1 Win=29200 Len=1428 TSval=1437 TSecr=1429
49078 → 5001 [ACK] Seq=183605 Ack=1 Win=29200 Len=1428 TSval=1437 TSecr=1429
5001 → 49078 [ACK] Seq=1 Ack=159329 Win=42232 Len=0 TSval=1433 TSecr=1419
49078 → 5001 [ACK] Seq=185033 Ack=1 Win=29200 Len=1428 TSval=1437 TSecr=1429
49078 → 5001 [ACK] Seq=186461 Ack=1 Win=29200 Len=1428 TSval=1437 TSecr=1429
5001 → 49078 [ACK] Seq=1 Ack=162185 Win=42232 Len=0 TSval=1434 TSecr=1419
49078 → 5001 [ACK] Seq=187889 Ack=1 Win=29200 Len=1428 TSval=1437 TSecr=1429
49078 → 5001 [ACK] Seq=189317 Ack=1 Win=29200 Len=1428 TSval=1437 TSecr=1429
49078 → 5001 [PSH, ACK] Seq=190745 Ack=1 Win=29200 Len=1428 TSval=1438 TSecr=1429
5001 → 49078 [ACK] Seq=1 Ack=165041 Win=42232 Len=0 TSval=1436 TSecr=1427
5001 → 49078 [ACK] Seq=1 Ack=167897 Win=42232 Len=0 TSval=1437 TSecr=1427
49078 → 5001 [ACK] Seq=192173 Ack=1 Win=29200 Len=1428 TSval=1445 TSecr=1437
49078 → 5001 [ACK] Seq=193601 Ack=1 Win=29200 Len=1428 TSval=1445 TSecr=1437
5001 → 49078 [ACK] Seq=1 Ack=170753 Win=42232 Len=0 TSval=1438 TSecr=1427
49078 → 5001 [ACK] Seq=195029 Ack=1 Win=29200 Len=1428 TSval=1445 TSecr=1437
49078 → 5001 [ACK] Seq=196457 Ack=1 Win=29200 Len=1428 TSval=1445 TSecr=1437
5001 → 49078 [ACK] Seq=1 Ack=173609 Win=42232 Len=0 TSval=1440 TSecr=1427
49078 → 5001 [ACK] Seq=197885 Ack=1 Win=29200 Len=1428 TSval=1445 TSecr=1437
49078 → 5001 [ACK] Seq=199313 Ack=1 Win=29200 Len=1428 TSval=1445 TSecr=1437
5001 → 49078 [ACK] Seq=1 Ack=176465 Win=42232 Len=0 TSval=1441 TSecr=1427
49078 → 5001 [ACK] Seq=200741 Ack=1 Win=29200 Len=1428 TSval=1445 TSecr=1437
49078 → 5001 [ACK] Seq=202169 Ack=1 Win=29200 Len=1428 TSval=1445 TSecr=1437
49078 → 5001 [ACK] Seq=203597 Ack=1 Win=29200 Len=1428 TSval=1445 TSecr=1437
49078 → 5001 [ACK] Seq=205025 Ack=1 Win=29200 Len=1428 TSval=1445 TSecr=1437
49078 → 5001 [ACK] Seq=206453 Ack=1 Win=29200 Len=1428 TSval=1445 TSecr=1437
49078 → 5001 [PSH, ACK] Seq=207881 Ack=1 Win=29200 Len=1428 TSval=1446 TSecr=1437
5001 → 49078 [ACK] Seq=1 Ack=179321 Win=42232 Len=0 TSval=1446 TSecr=1437
5001 → 49078 [ACK] Seq=1 Ack=182177 Win=42232 Len=0 TSval=1447 TSecr=1437
49078 → 5001 [ACK] Seq=209309 Ack=1 Win=29200 Len=1428 TSval=1454 TSecr=1447
49078 → 5001 [ACK] Seq=210737 Ack=1 Win=29200 Len=1428 TSval=1454 TSecr=1447
5001 → 49078 [ACK] Seq=1 Ack=185033 Win=42232 Len=0 TSval=1448 TSecr=1437
49078 → 5001 [ACK] Seq=212165 Ack=1 Win=29200 Len=1428 TSval=1454 TSecr=1447
49078 → 5001 [ACK] Seq=213593 Ack=1 Win=29200 Len=1428 TSval=1454 TSecr=1447
5001 → 49078 [ACK] Seq=1 Ack=187889 Win=42232 Len=0 TSval=1449 TSecr=1437
49078 → 5001 [ACK] Seq=215021 Ack=1 Win=29200 Len=1428 TSval=1454 TSecr=1447
49078 → 5001 [ACK] Seq=216449 Ack=1 Win=29200 Len=1428 TSval=1454 TSecr=1447
5001 → 49078 [ACK] Seq=1 Ack=190745 Win=42232 Len=0 TSval=1450 TSecr=1437
49078 → 5001 [ACK] Seq=217877 Ack=1 Win=29200 Len=1428 TSval=1454 TSecr=1447
49078 → 5001 [ACK] Seq=219305 Ack=1 Win=29200 Len=1428 TSval=1454 TSecr=1447
49078 → 5001 [ACK] Seq=220733 Ack=1 Win=29200 Len=1428 TSval=1454 TSecr=1447
49078 → 5001 [ACK] Seq=222161 Ack=1 Win=29200 Len=1428 TSval=1454 TSecr=1447
5001 → 5001 [PSH, ACK] Seq=127117 Ack=1 Win=29200 Len=1428 TSval=1456 TSecr=1425
5001 → 49078 [ACK] Seq=1 Ack=193601 Win=42232 Len=0 TSval=1453 TSecr=1438
5001 → 49078 [ACK] Seq=1 Ack=196457 Win=42232 Len=0 TSval=1454 TSecr=1445
5001 → 49078 [ACK] Seq=1 Ack=199313 Win=42232 Len=0 TSval=1455 TSecr=1445
49078 → 5001 [ACK] Seq=223589 Ack=1 Win=29200 Len=1428 TSval=1463 TSecr=1455
5001 → 5001 [ACK] Seq=1 Ack=127117 Win=42232 Len=0 TSval=1456 TSecr=1428
49078 → 5001 [ACK] Seq=225017 Ack=1 Win=29200 Len=1428 TSval=1463 TSecr=1455
5001 → 49078 [ACK] Seq=1 Ack=202169 Win=42232 Len=0 TSval=1456 TSecr=1445
49078 → 5001 [ACK] Seq=226445 Ack=1 Win=29200 Len=1428 TSval=1463 TSecr=1455
49078 → 5001 [ACK] Seq=227873 Ack=1 Win=29200 Len=1428 TSval=1463 TSecr=1455
5001 → 49078 [ACK] Seq=1 Ack=205025 Win=42232 Len=0 TSval=1458 TSecr=1445
49078 → 5001 [ACK] Seq=229301 Ack=1 Win=29200 Len=1428 TSval=1463 TSecr=1455
49078 → 5001 [ACK] Seq=230729 Ack=1 Win=29200 Len=1428 TSval=1463 TSecr=1455
5001 → 49078 [ACK] Seq=1 Ack=207881 Win=42232 Len=0 TSval=1459 TSecr=1445
49078 → 5001 [ACK] Seq=232157 Ack=1 Win=29200 Len=1428 TSval=1463 TSecr=1455
49078 → 5001 [ACK] Seq=233585 Ack=1 Win=29200 Len=1428 TSval=1463 TSecr=1455
49078 → 5001 [ACK] Seq=235013 Ack=1 Win=29200 Len=1428 TSval=1463 TSecr=1455
49078 → 5001 [ACK] Seq=236441 Ack=1 Win=29200 Len=1428 TSval=1463 TSecr=1455
49078 → 5001 [ACK] Seq=237869 Ack=1 Win=29200 Len=1428 TSval=1463 TSecr=1455
49078 → 5001 [PSH, ACK] Seq=239297 Ack=1 Win=29200 Len=1428 TSval=1464 TSecr=1455
5001 → 49078 [ACK] Seq=1 Ack=210737 Win=42232 Len=0 TSval=1462 TSecr=1446
5001 → 49078 [ACK] Seq=1 Ack=213593 Win=42232 Len=0 TSval=1464 TSecr=1454
5001 → 49078 [ACK] Seq=1 Ack=216449 Win=42232 Len=0 TSval=1465 TSecr=1454
49078 → 5001 [ACK] Seq=240725 Ack=1 Win=29200 Len=1428 TSval=1472 TSecr=1465
49078 → 5001 [ACK] Seq=242153 Ack=1 Win=29200 Len=1428 TSval=1472 TSecr=1465
5001 → 49078 [ACK] Seq=1 Ack=219305 Win=42232 Len=0 TSval=1466 TSecr=1454
49078 → 5001 [ACK] Seq=243581 Ack=1 Win=29200 Len=1428 TSval=1472 TSecr=1465
49078 → 5001 [ACK] Seq=245009 Ack=1 Win=29200 Len=1428 TSval=1472 TSecr=1465
5001 → 49078 [ACK] Seq=1 Ack=222161 Win=42232 Len=0 TSval=1467 TSecr=1454
49078 → 5001 [ACK] Seq=246437 Ack=1 Win=29200 Len=1428 TSval=1472 TSecr=1465
49078 → 5001 [ACK] Seq=247865 Ack=1 Win=29200 Len=1428 TSval=1472 TSecr=1465
49078 → 5001 [ACK] Seq=249293 Ack=1 Win=29200 Len=1428 TSval=1472 TSecr=1465
49078 → 5001 [ACK] Seq=250721 Ack=1 Win=29200 Len=1428 TSval=1472 TSecr=1465
49078 → 5001 [ACK] Seq=252149 Ack=1 Win=29200 Len=1428 TSval=1472 TSecr=1465
49078 → 5001 [ACK] Seq=253577 Ack=1 Win=29200 Len=1428 TSval=1472 TSecr=1465
49078 → 5001 [ACK] Seq=255005 Ack=1 Win=29200 Len=1428 TSval=1472 TSecr=1465
5001 → 49078 [ACK] Seq=1 Ack=225017 Win=42232 Len=0 TSval=1471 TSecr=1454
49078 → 5001 [PSH, ACK] Seq=256433 Ack=1 Win=29200 Len=1428 TSval=1474 TSecr=1465
5001 → 49078 [ACK] Seq=1 Ack=227873 Win=42232 Len=0 TSval=1472 TSecr=1463
5001 → 49078 [ACK] Seq=1 Ack=230729 Win=42232 Len=0 TSval=1473 TSecr=1463
49078 → 5001 [ACK] Seq=257861 Ack=1 Win=29200 Len=1428 TSval=1481 TSecr=1473
49078 → 5001 [ACK] Seq=259289 Ack=1 Win=29200 Len=1428 TSval=1481 TSecr=1473
5001 → 49078 [ACK] Seq=1 Ack=233585 Win=42232 Len=0 TSval=1475 TSecr=1463
49078 → 5001 [ACK] Seq=260717 Ack=1 Win=29200 Len=1428 TSval=1481 TSecr=1473
49078 → 5001 [ACK] Seq=262145 Ack=1 Win=29200 Len=1428 TSval=1481 TSecr=1473
5001 → 49078 [ACK] Seq=1 Ack=236441 Win=42232 Len=0 TSval=1476 TSecr=1463
49078 → 5001 [PSH, ACK] Seq=263573 Ack=1 Win=29200 Len=1124 TSval=1481 TSecr=1473
49078 → 5001 [ACK] Seq=264697 Ack=1 Win=29200 Len=1428 TSval=1481 TSecr=1473
49078 → 5001 [ACK] Seq=266125 Ack=1 Win=29200 Len=1428 TSval=1481 TSecr=1473
5001 → 49078 [ACK] Seq=1 Ack=239297 Win=42232 Len=0 TSval=1477 TSecr=1463
49078 → 5001 [ACK] Seq=267553 Ack=1 Win=29200 Len=1428 TSval=1481 TSecr=1473
49078 → 5001 [ACK] Seq=268981 Ack=1 Win=29200 Len=1428 TSval=1481 TSecr=1473
49078 → 5001 [ACK] Seq=270409 Ack=1 Win=29200 Len=1428 TSval=1481 TSecr=1473
5001 → 5001 [PSH, ACK] Seq=128545 Ack=1 Win=29200 Len=1428 TSval=1482 TSecr=1456
5001 → 49078 [ACK] Seq=1 Ack=242153 Win=42232 Len=0 TSval=1481 TSecr=1464
5001 → 49078 [ACK] Seq=1 Ack=245009 Win=42232 Len=0 TSval=1482 TSecr=1472
5001 → 5001 [ACK] Seq=1 Ack=128545 Win=42232 Len=0 TSval=1483 TSecr=1456
49078 → 5001 [ACK] Seq=271837 Ack=1 Win=29200 Len=1428 TSval=1490 TSecr=1482
5001 → 49078 [ACK] Seq=1 Ack=247865 Win=42232 Len=0 TSval=1483 TSecr=1472
49078 → 5001 [ACK] Seq=273265 Ack=1 Win=29200 Len=1428 TSval=1490 TSecr=1482
49078 → 5001 [ACK] Seq=274693 Ack=1 Win=29200 Len=1428 TSval=1490 TSecr=1482
5001 → 49078 [ACK] Seq=1 Ack=250721 Win=42232 Len=0 TSval=1484 TSecr=1472
49078 → 5001 [ACK] Seq=276121 Ack=1 Win=29200 Len=1428 TSval=1490 TSecr=1482
49078 → 5001 [ACK] Seq=277549 Ack=1 Win=29200 Len=1428 TSval=1490 TSecr=1482
5001 → 49078 [ACK] Seq=1 Ack=253577 Win=42232 Len=0 TSval=1485 TSecr=1472
49078 → 5001 [ACK] Seq=278977 Ack=1 Win=29200 Len=1428 TSval=1490 TSecr=1482
49078 → 5001 [ACK] Seq=280405 Ack=1 Win=29200 Len=1428 TSval=1490 TSecr=1482
5001 → 49078 [ACK] Seq=1 Ack=256433 Win=42232 Len=0 TSval=1487 TSecr=1472
49078 → 5001 [ACK] Seq=281833 Ack=1 Win=29200 Len=1428 TSval=1490 TSecr=1482
49078 → 5001 [ACK] Seq=283261 Ack=1 Win=29200 Len=1428 TSval=1490 TSecr=1482
49078 → 5001 [ACK] Seq=284689 Ack=1 Win=29200 Len=1428 TSval=1490 TSecr=1482
5001 → 5001 [PSH, ACK] Seq=129973 Ack=1 Win=29200 Len=1428 TSval=1490 TSecr=1483
5001 → 49078 [ACK] Seq=1 Ack=259289 Win=42232 Len=0 TSval=1489 TSecr=1474
5001 → 49078 [ACK] Seq=1 Ack=262145 Win=42232 Len=0 TSval=1490 TSecr=1481
49078 → 5001 [ACK] Seq=286117 Ack=1 Win=29200 Len=1428 TSval=1498 TSecr=1490
49078 → 5001 [ACK] Seq=287545 Ack=1 Win=29200 Len=1428 TSval=1498 TSecr=1490
5001 → 49078 [ACK] Seq=1 Ack=264697 Win=42232 Len=0 TSval=1491 TSecr=1481
49078 → 5001 [ACK] Seq=288973 Ack=1 Win=29200 Len=1428 TSval=1498 TSecr=1490
49078 → 5001 [ACK] Seq=290401 Ack=1 Win=29200 Len=1428 TSval=1498 TSecr=1490
5001 → 49078 [ACK] Seq=1 Ack=267553 Win=42232 Len=0 TSval=1492 TSecr=1481
49078 → 5001 [ACK] Seq=291829 Ack=1 Win=29200 Len=1428 TSval=1498 TSecr=1490
49078 → 5001 [ACK] Seq=293257 Ack=1 Win=29200 Len=1428 TSval=1498 TSecr=1490
5001 → 49078 [ACK] Seq=1 Ack=270409 Win=42232 Len=0 TSval=1494 TSecr=1481
49078 → 5001 [ACK] Seq=294685 Ack=1 Win=29200 Len=1428 TSval=1498 TSecr=1490
49078 → 5001 [ACK] Seq=296113 Ack=1 Win=29200 Len=1428 TSval=1498 TSecr=1490
49078 → 5001 [ACK] Seq=297541 Ack=1 Win=29200 Len=1428 TSval=1498 TSecr=1490
49078 → 5001 [ACK] Seq=298969 Ack=1 Win=29200 Len=1428 TSval=1498 TSecr=1490
49078 → 5001 [PSH, ACK] Seq=300397 Ack=1 Win=29200 Len=1428 TSval=1499 TSecr=1490
5001 → 49078 [ACK] Seq=1 Ack=273265 Win=42232 Len=0 TSval=1498 TSecr=1481
5001 → 49078 [ACK] Seq=1 Ack=276121 Win=42232 Len=0 TSval=1499 TSecr=1490
49078 → 5001 [ACK] Seq=301825 Ack=1 Win=29200 Len=1428 TSval=1507 TSecr=1499
49078 → 5001 [ACK] Seq=303253 Ack=1 Win=29200 Len=1428 TSval=1507 TSecr=1499
5001 → 49078 [ACK] Seq=1 Ack=278977 Win=42232 Len=0 TSval=1501 TSecr=1490
49078 → 5001 [ACK] Seq=304681 Ack=1 Win=29200 Len=1428 TSval=1507 TSecr=1499
49078 → 5001 [ACK] Seq=306109 Ack=1 Win=29200 Len=1428 TSval=1507 TSecr=1499
5001 → 49078 [ACK] Seq=1 Ack=281833 Win=42232 Len=0 TSval=1502 TSecr=1490
49078 → 5001 [ACK] Seq=307537 Ack=1 Win=29200 Len=1428 TSval=1507 TSecr=1499
49078 → 5001 [ACK] Seq=308965 Ack=1 Win=29200 Len=1428 TSval=1507 TSecr=1499
5001 → 49078 [ACK] Seq=1 Ack=284689 Win=42232 Len=0 TSval=1503 TSecr=1490
49078 → 5001 [ACK] Seq=310393 Ack=1 Win=29200 Len=1428 TSval=1507 TSecr=1499
49078 → 5001 [ACK] Seq=311821 Ack=1 Win=29200 Len=1428 TSval=1507 TSecr=1499
5001 → 5001 [ACK] Seq=1 Ack=131401 Win=42232 Len=0 TSval=1504 TSecr=1482
49078 → 5001 [ACK] Seq=313249 Ack=1 Win=29200 Len=1428 TSval=1507 TSecr=1499
49078 → 5001 [ACK] Seq=314677 Ack=1 Win=29200 Len=1428 TSval=1507 TSecr=1499
49078 → 5001 [PSH, ACK] Seq=316105 Ack=1 Win=29200 Len=1428 TSval=1508 TSecr=1499
5001 → 49078 [ACK] Seq=1 Ack=287545 Win=42232 Len=0 TSval=1506 TSecr=1490
5001 → 49078 [ACK] Seq=1 Ack=290401 Win=42232 Len=0 TSval=1507 TSecr=1498
49078 → 5001 [ACK] Seq=317533 Ack=1 Win=29200 Len=1428 TSval=1515 TSecr=1507
49078 → 5001 [ACK] Seq=318961 Ack=1 Win=29200 Len=1428 TSval=1515 TSecr=1507
5001 → 49078 [ACK] Seq=1 Ack=293257 Win=42232 Len=0 TSval=1508 TSecr=1498
49078 → 5001 [ACK] Seq=320389 Ack=1 Win=29200 Len=1428 TSval=1515 TSecr=1507
49078 → 5001 [ACK] Seq=321817 Ack=1 Win=29200 Len=1428 TSval=1515 TSecr=1507
5001 → 49078 [ACK] Seq=1 Ack=296113 Win=42232 Len=0 TSval=1509 TSecr=1498
49078 → 5001 [ACK] Seq=323245 Ack=1 Win=29200 Len=1428 TSval=1515 TSecr=1507
49078 → 5001 [ACK] Seq=324673 Ack=1 Win=29200 Len=1428 TSval=1515 TSecr=1507
5001 → 49078 [ACK] Seq=1 Ack=298969 Win=42232 Len=0 TSval=1511 TSecr=1498
49078 → 5001 [ACK] Seq=326101 Ack=1 Win=29200 Len=1428 TSval=1515 TSecr=1507
49078 → 5001 [ACK] Seq=327529 Ack=1 Win=29200 Len=1428 TSval=1515 TSecr=1507
5001 → 49078 [ACK] Seq=1 Ack=301825 Win=42232 Len=0 TSval=1512 TSecr=1498
49078 → 5001 [ACK] Seq=328957 Ack=1 Win=29200 Len=1428 TSval=1515 TSecr=1507
49078 → 5001 [ACK] Seq=330385 Ack=1 Win=29200 Len=1428 TSval=1515 TSecr=1507
5001 → 5001 [PSH, ACK] Seq=131401 Ack=1 Win=29200 Len=1428 TSval=1516 TSecr=1504
5001 → 49078 [ACK] Seq=1 Ack=304681 Win=42232 Len=0 TSval=1516 TSecr=1507
5001 → 49078 [ACK] Seq=1 Ack=307537 Win=42232 Len=0 TSval=1517 TSecr=1507
49078 → 5001 [ACK] Seq=331813 Ack=1 Win=29200 Len=1428 TSval=1524 TSecr=1517
49078 → 5001 [ACK] Seq=333241 Ack=1 Win=29200 Len=1428 TSval=1524 TSecr=1517
5001 → 49078 [ACK] Seq=1 Ack=310393 Win=42232 Len=0 TSval=1518 TSecr=1507
49078 → 5001 [ACK] Seq=334669 Ack=1 Win=29200 Len=1428 TSval=1524 TSecr=1517
49078 → 5001 [ACK] Seq=336097 Ack=1 Win=29200 Len=1428 TSval=1524 TSecr=1517
5001 → 49078 [ACK] Seq=1 Ack=313249 Win=42232 Len=0 TSval=1519 TSecr=1507
49078 → 5001 [ACK] Seq=337525 Ack=1 Win=29200 Len=1428 TSval=1524 TSecr=1517
49078 → 5001 [ACK] Seq=338953 Ack=1 Win=29200 Len=1428 TSval=1524 TSecr=1517
5001 → 49078 [ACK] Seq=1 Ack=316105 Win=42232 Len=0 TSval=1520 TSecr=1507
49078 → 5001 [ACK] Seq=340381 Ack=1 Win=29200 Len=1428 TSval=1524 TSecr=1517
49078 → 5001 [ACK] Seq=341809 Ack=1 Win=29200 Len=1428 TSval=1524 TSecr=1517
49078 → 5001 [ACK] Seq=343237 Ack=1 Win=29200 Len=1428 TSval=1524 TSecr=1517
49078 → 5001 [ACK] Seq=344665 Ack=1 Win=29200 Len=1428 TSval=1524 TSecr=1517
